Airport,Reason,num_cancelations,lat,lon,matched_name
"Santa Ana, CA: John Wayne Airport-Orange County",Weather,8,33.67570114,-117.8679962,John Wayne Airport-Orange County Airport
"Santa Barbara, CA: Santa Barbara Municipal",Weather,3,34.42620087,-119.8399963,Santa Barbara Municipal Airport
"Sarasota/Bradenton, FL: Sarasota/Bradenton International",Carrier,3,27.39539909362793,-82.55439758300781,Sarasota Bradenton International Airport
"Savannah, GA: Savannah/Hilton Head International",Weather,8,32.12760162,-81.20210266,Savannah Hilton Head International Airport
"Scranton/Wilkes-Barre, PA: Wilkes Barre Scranton International",Weather,4,41.3385009766,-75.72339630130001,Wilkes Barre Scranton International Airport
"Seattle, WA: Seattle/Tacoma International",Weather,25,47.449001,-122.308998,Seattle Tacoma International Airport
"Shreveport, LA: Shreveport Regional",Carrier,5,32.446602,-93.8256,Shreveport Regional Airport
"Sioux City, IA: Sioux Gateway Brig Gen Bud Day Field",National Air System,2,42.40259933,-96.38439941,Sioux Gateway Col. Bud Day Field
"Sioux Falls, SD: Joe Foss Field",Weather,7,43.5820007324,-96.741897583,Joe Foss Field Airport
"South Bend, IN: South Bend International",Weather,8,41.70869827270508,-86.31729888916016,South Bend Regional Airport
"Spokane, WA: Spokane International",Weather,3,47.61989974975586,-117.53399658203124,Spokane International Airport
"Springfield, IL: Abraham Lincoln Capital",Weather,3,39.84410095,-89.67790222,Abraham Lincoln Capital Airport
"Springfield, MO: Springfield-Branson National",National Air System,3,37.24570084,-93.38860321,Springfield Branson National Airport
"St. Louis, MO: St Louis Lambert International",Weather,40,38.748697,-90.370003,St Louis Lambert International Airport
"St. Petersburg, FL: St Pete Clearwater International",Weather,2,27.91020012,-82.68740082,St Petersburg Clearwater International Airport
"State College, PA: University Park",Weather,4,40.8493003845,-77.84870147710001,University Park Airport
"Staunton, VA: Shenandoah Valley Regional",Weather,1,38.2638015747,-78.8964004517,Shenandoah Valley Regional Airport
"Sun Valley/Hailey/Ketchum, ID: Friedman Memorial",Carrier,8,43.50439835,-114.2959976,Friedman Memorial Airport
"Syracuse, NY: Syracuse Hancock International",Weather,11,43.11119842529297,-76.1063003540039,Syracuse Hancock International Airport
"Tallahassee, FL: Tallahassee International",Carrier,3,30.396499633789062,-84.35030364990234,Tallahassee Regional Airport
"Tampa, FL: Tampa International",Weather,24,27.975500106811523,-82.533203125,Tampa International Airport
"Texarkana, AR: Texarkana Regional-Webb Field",Carrier,2,33.45370101928711,-93.99099731445312,Texarkana Regional Webb Field
"Toledo, OH: Toledo Express",National Air System,4,41.58679962,-83.80780029,Toledo Express Airport
"Traverse City, MI: Cherry Capital",Carrier,5,44.74140167236328,-85.58219909667969,Cherry Capital Airport
"Trenton, NJ: Trenton Mercer",Weather,3,40.27669906616211,-74.8134994506836,Trenton Mercer Airport
"Tucson, AZ: Tucson International",Carrier,4,32.1161003112793,-110.94100189208984,Tucson International Airport
"Tulsa, OK: Tulsa International",Weather,4,36.19839859008789,-95.88809967041016,Tulsa International Airport
"Tyler, TX: Tyler Pounds Regional",Weather,4,32.35409927368164,-95.40239715576172,Tyler Pounds Regional Airport
"Valparaiso, FL: Eglin AFB Destin Fort Walton Beach",Weather,3,30.4832,-86.525398,Destin-Ft Walton Beach Airport
"Vernal, UT: Vernal Regional",Weather,3,40.4408989,-109.5100021,Vernal Regional Airport
"Waco, TX: Waco Regional",Carrier,2,31.611299514770508,-97.23049926757812,Waco Regional Airport
"Washington, DC: Ronald Reagan Washington National",Weather,114,38.8521,-77.037697,Ronald Reagan Washington National Airport
"Washington, DC: Washington Dulles International",Weather,27,38.94449997,-77.45580292,Washington Dulles International Airport
"Waterloo, IA: Waterloo Regional",National Air System,2,43.4608001709,-80.3786010742,Waterloo Airport
"West Palm Beach/Palm Beach, FL: Palm Beach International",Weather,12,26.68320083618164,-80.09559631347656,Palm Beach International Airport
"White Plains, NY: Westchester County",Weather,13,41.06700134277344,-73.70760345458984,Westchester County Airport
"Wichita, KS: Wichita Dwight D Eisenhower National",Weather,14,37.649899,-97.433098,Wichita Eisenhower National Airport
"Wilmington, NC: Wilmington International",Weather,3,34.270599365234375,-77.90260314941406,Wilmington International Airport
"Worcester, MA: Worcester Regional",Weather,1,42.26729965209961,-71.87570190429688,Worcester Regional Airport
"Yakutat, AK: Yakutat Airport",Weather,1,59.5032997131,-139.660003662,Yakutat Airport
